metric;value 
	Number of MetaClass;7
	Number of abstract MetaClass;2
	Number of concrete MetaClass;5
	Number of concrete Completely Featureless MetaClass;2
	Number of immediate Featureless MetaClass;3
	Number of abstract immediate Featureless MetaClass;0
	Number of concrete immediate Featureless MetaClass;3
	Number of Total eStructuralFeature;6
	Number of Total structural feature with inherited;11
	Number of Completely Featureless MetaClass;2
	Number of abstract Completely Featureless MetaClass;0
	Number of TotalReference;3
	Number of Opposite Reference;0
	Number of TotalReference containment;2
	Number of Total Attribute;3
	Number of Total Attribute with inherited;7
	Max generalizzation hierarchical level;2
	Max chain of containment;50
	Max Reference Sibiling (max fan Out);2
	Average Reference in a (class (avg fan out);0.42857142857142855
	Average Attribute in a class;0.42857142857142855
	AIF;0.8333333333333334
	Number of class with a super type;3
	Max Hierarchy Sibiling;2
	Number of lonely classes;3
	Min number of feature in classes;0
	Sum of Total predecessor in hierarchies;4
