metric;value 
	Number of MetaClass;8
	Number of abstract MetaClass;3
	Number of concrete MetaClass;5
	Number of concrete Completely Featureless MetaClass;0
	Number of immediate Featureless MetaClass;2
	Number of abstract immediate Featureless MetaClass;0
	Number of concrete immediate Featureless MetaClass;2
	Number of Total eStructuralFeature;10
	Number of Total structural feature with inherited;23
	Number of Completely Featureless MetaClass;0
	Number of abstract Completely Featureless MetaClass;0
	Number of TotalReference;7
	Number of Opposite Reference;6
	Number of TotalReference containment;2
	Number of Total Attribute;3
	Number of Total Attribute with inherited;7
	Max generalizzation hierarchical level;1
	Max chain of containment;50
	Max Reference Sibiling (max fan Out);3
	Average Reference in a (class (avg fan out);0.875
	Average Attribute in a class;0.375
	AIF;1.3
	Number of class with a super type;5
	Max Hierarchy Sibiling;3
	Number of lonely classes;2
	Min number of feature in classes;1
	Sum of Total predecessor in hierarchies;5
