metric;value 
	Number of MetaClass;12
	Number of abstract MetaClass;3
	Number of concrete MetaClass;9
	Number of concrete Completely Featureless MetaClass;1
	Number of immediate Featureless MetaClass;3
	Number of abstract immediate Featureless MetaClass;0
	Number of concrete immediate Featureless MetaClass;3
	Number of Total eStructuralFeature;22
	Number of Total structural feature with inherited;59
	Number of Completely Featureless MetaClass;1
	Number of abstract Completely Featureless MetaClass;0
	Number of TotalReference;12
	Number of Opposite Reference;10
	Number of TotalReference containment;2
	Number of Total Attribute;10
	Number of Total Attribute with inherited;37
	Max generalizzation hierarchical level;4
	Max chain of containment;50
	Max Reference Sibiling (max fan Out);3
	Average Reference in a (class (avg fan out);1.0
	Average Attribute in a class;0.8333333333333334
	AIF;1.6818181818181819
	Number of class with a super type;10
	Max Hierarchy Sibiling;3
	Number of lonely classes;3
	Min number of feature in classes;0
	Sum of Total predecessor in hierarchies;27
